{
  "$schema": "https://json-schema.org/draft/2020-12/schema",
  "$id": "urn:marketing-v7:runtime:event-envelope:1.0",
  "type": "object",
  "properties": {
    "schema_version": {
      "const": "1.0"
    },
    "event_id": {
      "$ref": "urn:marketing-v7:runtime:common:1.0#/$defs/id"
    },
    "source": {
      "$ref": "urn:marketing-v7:runtime:common:1.0#/$defs/id"
    },
    "event_type": {
      "$ref": "urn:marketing-v7:runtime:common:1.0#/$defs/id"
    },
    "client_id": {
      "$ref": "urn:marketing-v7:runtime:common:1.0#/$defs/id"
    },
    "correlation_id": {
      "$ref": "urn:marketing-v7:runtime:common:1.0#/$defs/id"
    },
    "idempotency_key": {
      "$ref": "urn:marketing-v7:runtime:common:1.0#/$defs/id"
    },
    "authority_ref": {
      "$ref": "urn:marketing-v7:runtime:common:1.0#/$defs/id"
    },
    "payload_ref": {
      "$ref": "urn:marketing-v7:runtime:common:1.0#/$defs/id"
    },
    "workflow_id": {
      "enum": [
        "C01",
        "C02",
        "C03",
        "C04",
        "C05",
        "C06",
        "C07",
        "C08",
        "C09",
        "C10",
        "C11",
        "C12",
        "C13",
        "C14",
        "C15",
        "C16",
        "C17",
        "C18",
        "C19",
        "C20",
        "C21",
        "C22",
        "C23",
        "C24",
        "C25",
        "C26",
        "C27",
        "C28",
        "C29",
        "C30",
        "C31",
        "C32",
        "C33",
        "C34",
        "C35",
        "C36",
        "C37",
        "C38",
        "C39",
        "C40",
        "C41",
        "C42",
        "C43",
        "C44",
        "C45",
        "C46",
        "C47",
        "C48",
        "C49",
        "C50",
        "C51",
        "C52",
        "C53",
        "C54",
        "C55",
        "C56",
        "C57",
        "C58",
        "C59",
        "C60",
        "C61",
        "C62",
        "C63",
        "C64",
        "C65",
        "C66",
        "C67",
        "C68",
        "C69",
        "C70",
        "C71",
        "C72",
        "E01",
        "E02",
        "E03",
        "E04",
        "E05",
        "E06",
        "E07",
        "E08",
        "E09",
        "E10",
        "E11",
        "E12",
        "E13",
        "E14",
        "I01",
        "I02",
        "I03",
        "I04",
        "I05",
        "I06",
        "I07",
        "I08",
        "I09",
        "I10",
        "I11",
        "I12",
        "I13",
        "I14",
        "I15",
        "I16",
        "I17",
        "I18",
        "I19",
        "I20",
        "I21",
        "I22",
        "I23",
        "I24",
        "I25",
        "I26",
        "I27",
        "I28",
        "I29",
        "I30",
        "I31",
        "I32",
        "I33",
        "I34",
        "I35",
        "I36",
        "L01",
        "L02",
        "L03",
        "L04",
        "L05",
        "L06",
        "L07",
        "L08",
        "M01",
        "M02",
        "M03",
        "M04",
        "M05",
        "M06",
        "M07",
        "M08",
        "M09",
        "M10",
        "M11",
        "M12",
        "M13",
        "M14",
        "M15",
        "M16",
        "M17",
        "M18",
        "M19",
        "M20",
        "M21",
        "M22",
        "M23",
        "M24",
        "M25",
        "M26",
        "M27",
        "M28",
        "M29",
        "M30",
        "M31",
        "M32",
        "M33",
        "M34",
        "M35",
        "M36",
        "V01",
        "V02",
        "V03",
        "V04",
        "V05",
        "V06",
        "V07",
        "V08",
        "V09",
        "V10",
        "V11",
        "V12",
        "X01",
        "X02",
        "X03",
        "X04",
        "X05",
        "X06",
        "X07",
        "X08",
        "X09",
        "X10",
        "X11",
        "X12"
      ]
    },
    "occurred_at": {
      "$ref": "urn:marketing-v7:runtime:common:1.0#/$defs/datetime"
    },
    "received_at": {
      "$ref": "urn:marketing-v7:runtime:common:1.0#/$defs/datetime"
    },
    "approval_ref": {
      "anyOf": [
        {
          "$ref": "urn:marketing-v7:runtime:common:1.0#/$defs/id"
        },
        {
          "type": "null"
        }
      ]
    },
    "channel_eligibility_ref": {
      "anyOf": [
        {
          "$ref": "urn:marketing-v7:runtime:common:1.0#/$defs/id"
        },
        {
          "type": "null"
        }
      ]
    },
    "default_outbound_state": {
      "const": "HOLD"
    }
  },
  "required": [
    "schema_version",
    "event_id",
    "source",
    "event_type",
    "client_id",
    "correlation_id",
    "idempotency_key",
    "authority_ref",
    "payload_ref",
    "workflow_id",
    "occurred_at",
    "received_at",
    "approval_ref",
    "channel_eligibility_ref",
    "default_outbound_state"
  ],
  "additionalProperties": false
}
